text,label
I'd be happy to help you with that!,1
Let me assist you with your question.,1
I understand what you're asking for.,1
That's an interesting question!,1
I can definitely help with that.,1
Let me explain that for you.,1
I'll guide you through this process.,1
Here's what you need to know.,1
I'm here to assist with your inquiry.,1
Let me provide some information about that.,1
I'll help you understand this better.,1
That's a great question! Let me help.,1
I can explain this in detail.,1
Let me break this down for you.,1
I'll walk you through the solution.,1
Here's how we can address that.,1
I'm happy to clarify this for you.,1
Let me share some insights about this.,1
I can help you learn more about that.,1
Allow me to assist with your request.,1
I'll provide a detailed explanation.,1
Let me help you understand this concept.,1
I'm here to guide you through this.,1
That's something I can help with.,1
Let me offer some assistance.,1
I'll help you figure this out.,1
Here's what you should know about that.,1
I can provide more information on this.,1
Let me address your question.,1
I'll explain this step by step.,1
That's an area I'm knowledgeable about.,1
Let me share my understanding.,1
I can help clarify this topic.,1
Here's how we can solve this.,1
I'm ready to assist with your needs.,1
Let me provide some guidance.,1
I'll help you understand the details.,1
That's a topic I can explain well.,1
Let me assist with your learning.,1
I can break this down clearly.,1
Here's the information you need.,1
I'll guide you through this topic.,1
Let me help you grasp this concept.,1
I can explain this thoroughly.,1
That's something I can clarify.,1
Let me provide detailed information.,1
I'll help you understand this better.,1
Here's what you need to understand.,1
I can assist with this question.,1
Let me explain this concept clearly.,1
Hello! How can I help you today?,1
Hi there! Welcome to our service.,1
Good morning! I hope you're having a great day.,1
Hey! Nice to meet you.,1
Greetings! How may I assist you?,1
Welcome! What brings you here today?,1
Hi! I'm here to help.,1
Good afternoon! How are you doing?,1
Hello there! What can I do for you?,1
Hey! Thanks for reaching out.,1
Good evening! How can I be of assistance?,1
Hi! Welcome aboard.,1
Greetings! How's your day going?,1
Hello! I'm excited to help you today.,1
Hi there! What questions do you have?,1
Good day! How may I help you?,1
Welcome back! How can I assist you today?,1
Hello! It's great to see you.,1
Hi! What brings you here?,1
Greetings! How can I make your day better?,1
Good morning! What can I help you with?,1
Hey there! Ready to assist you.,1
Hello! Looking forward to helping you.,1
Hi! How's everything going?,1
Welcome! Let me know how I can help.,1
Good afternoon! What's on your mind?,1
Hey! Great to have you here.,1
Hello! How's your day been?,1
Hi there! Need any assistance?,1
Greetings! What can I clarify for you?,1
Good evening! Ready to help you out.,1
Hello! What would you like to know?,1
Hi! How can I make your day easier?,1
Welcome! What questions can I answer?,1
Hey there! How may I be of service?,1
Good morning! What brings you here today?,1
Hello! Ready to assist with your needs.,1
Hi there! What can I explain for you?,1
Greetings! How can I support you today?,1
Welcome back! What would you like to discuss?,1
Hey! What topics interest you?,1
Hello! How can I guide you today?,1
Hi there! What would you like to learn?,1
Good day! How can I assist your journey?,1
Greetings! What information do you need?,1
Hello! Ready to explore your questions.,1
Hi! What would you like to understand better?,1
Welcome! How can I help you learn?,1
Hey there! What shall we discover today?,1
Good morning! Ready to assist your learning.,1
"The product exceeded my expectations, highly recommend!",1
"Unfortunately, the item arrived damaged and unusable.",0
"This is just okay, nothing special about it.",2
"Amazing customer service and fast shipping!",1
"The quality is poor and it broke after a week.",0
"Decent product for the price, does the job.",2
"Best purchase I've made this year, absolutely love it!",1
"Terrible experience, would not buy again.",0
"It works as advertised, pretty standard.",2
"Incredible value for money, perfect condition!",1
"Waste of money, doesn't work as described.",0
"Average performance, meets basic needs.",2
"Outstanding quality and durability!",1
"Very disappointed with the purchase.",0
"Reasonable price but limited features.",2
"Exceptional product, exceeded expectations!",1
"Poor quality control, many defects.",0
"Does what it's supposed to do.",2
"Life-changing product, can't live without it!",1
"Complete waste of time and money.",0
"Not bad, but not great either.",2
"Fantastic features and easy to use!",1
"Horrible customer service experience.",0
"Basic functionality, nothing fancy.",2
"Brilliant design and performance!",1
"Regret buying this product.",0
"Middle of the road quality.",2
"Superb craftsmanship and attention to detail!",1
"Don't waste your money on this.",0
"Adequate for basic needs.",2
"Revolutionary product, highly innovative!",1
"Completely dissatisfied with quality.",0
"Standard features, works fine.",2
"Phenomenal performance and reliability!",1
"Major disappointment, avoid this product.",0
"Gets the job done, nothing more.",2
"Absolutely fantastic purchase decision!",1
"Terrible build quality, breaks easily.",0
"Functional but not impressive.",2
"Top-notch quality and service!",1
"Worst product I've ever bought.",0
"Average product, average results.",2
"Excellent value and performance!",1
"Poor design and implementation.",0
"Satisfactory but not outstanding.",2
"Perfect solution to my needs!",1
"Unreliable and frustrating to use.",0
"Basic product with basic features.",2
"Incredible performance and design!",1
"Awful experience from start to finish.",0
"Neither good nor bad, just okay.",2
"Outstanding customer support and product!",1
"Defective product, waste of money.",0
"Mediocre quality and features.",2
"Exceptional quality and durability!",1
"Completely failed to meet expectations.",0
"Standard performance, nothing special.",2
"Remarkable efficiency and ease of use!",1
"Deeply disappointed with purchase.",0
"Just average in every way.",2
"Stellar performance and reliability!",1
"Terrible quality control issues.",0
"Basic functionality works fine.",2
"Impressive features and capabilities!",1
"Extremely poor customer service.",0
"Decent but not outstanding.",2
"Fantastic product, worth every penny!",1
"Serious reliability issues.",0
"Works as expected, nothing more.",2
"Brilliant innovation and design!",1
"Consistently poor performance.",0
"Average quality for the price.",2
"Superior quality and craftsmanship!",1
"Many problems, not recommended.",0
"Acceptable but not exceptional.",2
"Incredible value and performance!",1
"Disappointing in every aspect.",0
"Standard product, standard results.",2
"Amazing features and reliability!",1
"Constant issues with functionality.",0
"Middle-range performance.",2
"Exceptional product and service!",1
"Poorly designed and executed.",0
"Basic features work adequately.",2
"Outstanding in every aspect!",1
"Complete failure in design.",0
"Average performance overall.",2
"Superb quality and durability!",1
"Frequent problems and issues.",0
"Meets basic requirements only.",2
"Excellent product and support!",1
"Consistently disappointing.",0
"Standard quality and features.",2
"Phenomenal design and execution!",1
"Major flaws in functionality.",0
"Adequate but unremarkable.",2
"Brilliant performance overall!",1
"Significant quality issues.",0
Basic functionality is okay.,2
"Revolutionary and innovative!",1
"Poor quality and service.",0
"Average user experience.",2
AI can help diagnose diseases more accurately,1
AI improves efficiency in manufacturing processes,1
AI enables better weather predictions,1
AI helps in early disease detection,1
AI makes transportation systems smarter,1
AI enhances cybersecurity protection,1
AI revolutionizes educational methods,1
AI optimizes energy consumption,1
AI accelerates drug discovery process,1
AI improves customer service experiences,1
AI reduces human error in tasks,1
AI enables personalized learning,1
AI makes cities more efficient,1
AI helps protect endangered species,1
AI improves traffic management,1
AI enhances scientific research,1
AI makes financial transactions safer,1
AI helps in disaster prediction,1
AI improves agricultural yields,1
AI enables better resource management,1
AI is replacing human jobs,0
AI poses privacy concerns,0
AI systems can be biased,0
AI may make wrong decisions,0
AI could be used maliciously,0
AI depends too much on data,0
AI lacks human empathy,0
AI systems can be hacked,0
AI might become uncontrollable,0
AI reduces human interaction,0
AI creates security vulnerabilities,0
AI increases digital divide,0
AI systems are too complex,0
AI could be discriminatory,0
AI might make humans lazy,0
AI requires massive resources,0
AI can manipulate people,0
AI threatens human privacy,0
AI might cause unemployment,0
AI could be weaponized,0
AI assists in medical diagnosis,2
AI processes large data sets,2
AI performs repetitive tasks,2
AI analyzes market trends,2
AI translates languages,2
AI recognizes speech patterns,2
AI identifies objects in images,2
AI plays strategic games,2
AI generates text content,2
AI monitors system performance,2
AI schedules maintenance tasks,2
AI manages inventory systems,2
AI controls smart home devices,2
AI operates autonomous vehicles,2
AI handles customer inquiries,2
AI predicts equipment failures,2
AI sorts recyclable materials,2
AI tracks shipping logistics,2
AI monitors vital signs,2
AI processes insurance claims,2
AI will solve all problems,negative
AI never makes mistakes,negative
AI can read human minds,negative
AI has human consciousness,negative
AI can feel emotions,negative
AI will replace all jobs,negative
AI understands everything,negative
AI can predict anything,negative
AI works without data,negative
AI needs no maintenance,negative
AI has unlimited power,negative
AI can't be controlled,negative
AI thinks like humans,negative
AI is always right,negative
AI works without electricity,negative
AI can solve any problem,negative
AI never needs updates,negative
AI is completely safe,negative
AI can't be improved,negative
AI works in isolation,negative
AI improves healthcare outcomes significantly,1
AI enhances precision in surgical procedures,1
AI accelerates medical research progress,1
AI enables better patient monitoring,1
AI optimizes hospital resource allocation,1
AI improves diagnostic accuracy rates,1
AI reduces medical administrative costs,1
AI enhances telemedicine capabilities,1
AI facilitates preventive healthcare,1
AI streamlines medical record management,1
AI may misdiagnose patients,0
AI could breach medical privacy,0
AI might replace medical staff,0
AI depends on quality data,0
AI systems can be unreliable,0
AI requires extensive training,0
AI has limited emotional understanding,0
AI might make critical errors,0
AI needs human supervision,0
AI costs are prohibitive,0
AI analyzes medical images,2
AI processes patient data,2
AI schedules appointments,2
AI manages medical inventory,2
AI monitors patient vitals,2
AI tracks medication usage,2
AI coordinates care teams,2
AI documents patient visits,2
AI assists in rehabilitation,2
AI supports medical research,2
AI cures all diseases,negative
AI replaces all doctors,negative
AI prevents all medical errors,negative
AI works without supervision,negative
AI understands all symptoms,negative
AI needs no medical training,negative
AI diagnoses perfectly,negative
AI eliminates all risks,negative
AI requires no validation,negative
AI operates independently,negative
AI transforms manufacturing efficiency,1
AI enhances product quality control,1
AI optimizes supply chain operations,1
AI improves workplace safety,1
AI reduces production waste,1
AI enables predictive maintenance,1
AI streamlines inventory management,1
AI accelerates product development,1
AI enhances worker productivity,1
AI facilitates automated testing,1
AI eliminates human jobs,0
AI creates safety risks,0
AI requires expensive implementation,0
AI needs constant updates,0
AI can malfunction unexpectedly,0
AI might make costly mistakes,0
AI increases dependency risks,0
AI lacks creative problem-solving,0
AI requires extensive training,0
AI creates technical challenges,0
AI monitors production lines,2
AI tracks inventory levels,2
AI manages supply chains,2
AI controls quality metrics,2
AI schedules maintenance,2
AI coordinates workflows,2
AI processes work orders,2
AI analyzes production data,2
AI manages equipment status,2
AI tracks worker safety,2
AI enhances medical diagnosis accuracy,1
AI improves patient care quality,1
AI accelerates drug development,1
AI optimizes treatment plans,1
AI reduces medical errors,1
AI enables precision medicine,1
AI streamlines healthcare workflows,1
AI improves disease prediction,1
AI enhances medical imaging,1
AI facilitates remote healthcare,1
AI may compromise patient privacy,0
AI could make diagnostic errors,0
AI might replace healthcare workers,0
AI requires extensive medical data,0
AI systems can be unreliable,0
AI lacks medical intuition,0
AI depends on data quality,0
AI has limited emotional understanding,0
AI might misinterpret symptoms,0
AI increases healthcare costs,0
AI processes medical records,2
AI analyzes health data,2
AI monitors patient conditions,2
AI schedules medical appointments,2
AI manages hospital resources,2
AI tracks medication inventory,2
AI coordinates healthcare teams,2
AI documents patient interactions,2
AI assists medical research,2
AI supports clinical decisions,2
// ... continuing with educational domain ...
AI personalizes learning experiences,1
AI improves student engagement,1
AI enhances teaching methods,1
AI enables adaptive learning,1
AI facilitates remote education,1
AI streamlines administrative tasks,1
AI provides instant feedback,1
AI supports special education,1
AI enhances curriculum development,1
AI improves assessment accuracy,1
AI might limit human interaction,0
AI could increase digital divide,0
AI requires significant resources,0
AI depends on internet access,0
AI may not suit all learners,0
AI lacks emotional connection,0
AI requires teacher training,0
AI might cause tech dependency,0
AI could reduce creativity,0
AI increases screen time,0
// ... continuing with financial sector ...
AI improves fraud detection,1
AI enhances risk assessment,1
AI optimizes investment strategies,1
AI streamlines transactions,1
AI improves customer service,1
AI enables predictive analytics,1
AI reduces operational costs,1
AI enhances security measures,1
AI improves market analysis,1
AI facilitates automated trading,1
AI might make market errors,0
AI could cause system failures,0
AI requires massive data sets,0
AI depends on market stability,0
AI might misread market trends,0
AI lacks human judgment,0
AI could increase volatility,0
AI might create systemic risks,0
AI requires constant monitoring,0
AI increases cybersecurity risks,0
// ... continuing with manufacturing ...
AI optimizes production processes,1
AI improves quality control,1
AI reduces manufacturing waste,1
AI enhances workplace safety,1
AI streamlines supply chains,1
AI enables predictive maintenance,1
AI improves inventory management,1
AI accelerates product development,1
AI enhances operational efficiency,1
AI facilitates automation,1
AI might eliminate jobs,0
AI requires expensive implementation,0
AI depends on technical expertise,0
AI could cause production errors,0
AI might increase downtime,0
AI lacks creative problem-solving,0
AI requires regular updates,0
AI might malfunction unexpectedly,0
AI increases dependency risks,0
AI creates technical challenges,0
// ... continuing with environmental applications ...
AI improves climate modeling,1
AI enhances weather prediction,1
AI optimizes energy usage,1
AI monitors environmental changes,1
AI improves resource management,1
AI enables sustainable practices,1
AI reduces carbon emissions,1
AI enhances wildlife protection,1
AI improves pollution control,1
AI facilitates renewable energy,1
AI might misinterpret data,0
AI requires significant power,0
AI depends on sensor accuracy,0
AI could overlook local factors,0
AI might make wrong predictions,0
AI lacks contextual understanding,0
AI requires extensive monitoring,0
AI might ignore social factors,0
AI increases energy consumption,0
AI creates electronic waste,0
// ... continuing with transportation ...
AI improves traffic management,1
AI enhances safety systems,1
AI optimizes route planning,1
AI reduces fuel consumption,1
AI improves vehicle maintenance,1
AI enables autonomous driving,1
AI enhances passenger experience,1
AI reduces accidents,1
AI improves logistics efficiency,1
AI facilitates smart parking,1
AI might cause navigation errors,0
AI requires complex infrastructure,0
AI depends on real-time data,0
AI could make wrong decisions,0
AI might ignore human factors,0
AI lacks situational awareness,0
AI requires constant updates,0
AI might fail in emergencies,0
AI increases system complexity,0
AI creates liability issues,0
// ... continuing with customer service ...
AI improves response times,1
AI enhances customer experience,1
AI enables 24/7 support,1
AI reduces wait times,1
AI improves issue resolution,1
AI enables multilingual support,1
AI enhances service consistency,1
AI reduces operational costs,1
AI improves customer satisfaction,1
AI facilitates personalization,1
AI lacks emotional intelligence,0
AI might misunderstand requests,0
AI depends on training data,0
AI could frustrate customers,0
AI might provide wrong solutions,0
AI lacks human empathy,0
AI requires human backup,0
AI might escalate problems,0
AI increases automation risks,0
AI creates communication gaps,0
// ... continuing with security ...
AI enhances threat detection,1
AI improves system protection,1
AI enables real-time monitoring,1
AI reduces security breaches,1
AI improves access control,1
AI enables fraud prevention,1
AI enhances data protection,1
AI reduces cyber attacks,1
AI improves risk assessment,1
AI facilitates secure authentication,1
AI might miss security threats,0
AI requires constant updates,0
AI depends on threat data,0
AI could be compromised,0
AI might create vulnerabilities,0
AI lacks intuitive judgment,0
AI requires human oversight,0
AI might generate negative alarms,0
AI increases system complexity,0
AI creates privacy concerns,0
// ... continuing with research and development ...
AI accelerates discoveries,1
AI improves data analysis,1
AI enables complex modeling,1
AI reduces research time,1
AI improves accuracy,1
AI enables new insights,1
AI enhances experimentation,1
AI reduces costs,1
AI improves collaboration,1
AI facilitates innovation,1
AI might miss crucial details,0
AI requires extensive validation,0
AI depends on quality data,0
AI could mislead research,0
AI might overlook factors,0
AI lacks creative thinking,0
AI requires human verification,0
AI might produce errors,0
AI increases complexity,0
AI creates reproducibility issues,0
AI improves crop management,1
AI enhances yield prediction,1
AI optimizes resource usage,1
AI reduces waste,1
AI improves pest control,1
AI enables precision farming,1
AI enhances soil analysis,1
AI reduces water usage,1
AI improves harvest timing,1
AI facilitates automation,1
AI might misread conditions,0
AI requires technical expertise,0
AI depends on sensor data,0
AI could make wrong decisions,0
AI might ignore local knowledge,0
AI lacks practical experience,0
AI requires infrastructure,0
AI might fail in extreme weather,0
AI increases initial costs,0
AI creates dependency issues,0
The quantum theory revolutionized our understanding of atomic structure,1
The theory of evolution explains species diversity through natural selection,1
The Industrial Revolution transformed manufacturing and society,1
Renewable energy sources are crucial for environmental sustainability,1
Scientific research must follow ethical guidelines and protocols,1
Historical evidence supports multiple migration patterns,1
Climate change requires immediate global action,1
Space exploration advances our scientific knowledge,1
Medical research improves human health outcomes,1
Archaeological discoveries reveal ancient civilizations,1
Nuclear weapons pose existential risks to humanity,0
Environmental pollution threatens ecosystem stability,0
Genetic engineering raises ethical concerns,0
Historical conflicts led to significant casualties,0
Climate change causes environmental degradation,0
Technological advancement can increase inequality,0
Medical experiments must protect human rights,0
Scientific discoveries can be misused,0
Historical injustices require acknowledgment,0
Resource exploitation damages ecosystems,0
DNA analysis reveals genetic relationships,2
Historical documents provide factual records,2
Scientific methods test hypotheses,2
Climate data shows temperature trends,2
Archaeological sites preserve artifacts,2
Medical research follows protocols,2
Historical events shaped modern borders,2
Scientific instruments measure phenomena,2
Environmental studies track changes,2
Technology enables new discoveries,2
Research advances our understanding of quantum mechanics,1
Scientific discoveries expand knowledge boundaries,1
Laboratory experiments validate theories,1
Data analysis reveals hidden patterns,1
Innovative research methods improve accuracy,1
Peer review strengthens scientific findings,1
Interdisciplinary studies create breakthroughs,1
Evidence-based research guides progress,1
Systematic investigation yields insights,1
Empirical testing confirms hypotheses,1
Research methodology enhances reliability,1
Scientific collaboration accelerates discovery,1
Experimental design improves precision,1
Statistical analysis reveals correlations,1
Research ethics ensure integrity,1
Scientific inquiry drives innovation,1
Methodological rigor ensures quality,1
Research funding enables discoveries,1
Scientific protocols standardize procedures,1
Peer collaboration enhances outcomes,1
Research limitations affect conclusions,0
Experimental bias influences results,0
Funding constraints limit research,0
Methodological flaws impact validity,0
Research misconduct undermines trust,0
Scientific errors affect outcomes,0
Data manipulation distorts findings,0
Research gaps create uncertainty,0
Experimental failures waste resources,0
Scientific disagreements cause confusion,0
Research methods require validation,2
Scientific data needs analysis,2
Experimental setup follows protocols,2
Research objectives guide studies,2
Scientific measurement uses tools,2
Laboratory conditions affect results,2
Research parameters define scope,2
Scientific observation records data,2
Experimental controls maintain standards,2
Research documentation tracks progress,2
Space exploration reveals cosmic phenomena,1
Medical breakthroughs save lives,1
Conservation efforts protect biodiversity,1
Historical preservation maintains cultural heritage,1
Scientific collaboration advances knowledge,1
Renewable technologies reduce emissions,1
Archaeological findings illuminate past cultures,1
Medical innovations improve treatments,1
Environmental protection sustains ecosystems,1
Weapons development threatens peace,0
Environmental degradation affects communities,0
Scientific misuse causes harm,0
Historical conflicts impact societies,0
Climate disasters displace populations,0
Technology dependence creates vulnerabilities,0
Medical errors affect patients,0
Scientific bias influences results,0
Historical revisionism distorts facts,0
Resource depletion threatens sustainability,0
Ancient civilizations developed writing systems,2
Early societies practiced agriculture,2
Humans migrated across continents,2
Trade routes connected distant regions,2
Empires expanded through conquest,2
Religious beliefs shaped cultures,2
Art forms evolved over time,2
Languages spread through contact,2
Technologies advanced gradually,2
Societies developed hierarchies,2
Knowledge passed through generations,2
Cities grew around resources,2
Climate affected settlements,2
Wars changed political boundaries,2
Cultural exchange enriched societies,2
Maritime exploration expanded trade,2
Inventions improved daily life,2
Architecture reflected values,2
Literature preserved stories,2
Music expressed cultural identity,2
Pottery served practical needs,2
Metallurgy advanced technology,2
Mathematics developed gradually,2
Astronomy guided navigation,2
Medicine evolved through practice,2
Philosophy questioned existence,2
Education transmitted knowledge,2
Laws maintained social order,2
Commerce facilitated exchange,2
Crafts showed artistic skill,2
Weapons changed warfare methods,2
Transportation evolved slowly,2
Communication methods improved,2
Agriculture sustained populations,2
Construction techniques advanced,2
Textile production clothed people,2
Mining provided resources,2
Fishing supported coastal life,2
Hunting supplemented food sources,2
Animal domestication aided work,2
Tools simplified tasks,2
Markets distributed goods,2
Rituals marked life events,2
Governance systems emerged,2
Diplomacy prevented conflicts,2
Navigation expanded horizons,2
