text,label
Cultural exchange unites nations,1
Peace processes bring hope,1
Diplomatic channels strengthen relations,1
International law guides peace,1
Cultural understanding enables growth,1
Peace initiatives save communities,1
Diplomatic efforts prevent war,1
International dialogue builds trust,1
Cultural bridges promote harmony,1
Peace talks unite hearts,1
Diplomatic work helps stability,1
International cooperation brings hope,1
Cultural respect enables progress,1
Peace building strengthens peace,1
Diplomatic channels save lives,1
International unity prevents conflict,1
Cultural exchange builds bridges,1
Peace efforts unite nations,1
Diplomatic ties promote harmony,1
International law protects all,1
Cultural understanding brings hope,1
Peace processes help stability,1
Diplomatic work enables growth,1
International dialogue saves communities,1
Cultural bridges prevent war,1
Peace initiatives strengthen relations,1
Diplomatic efforts unite hearts,1
International cooperation builds trust,1
Cultural respect promotes harmony,1
Peace talks bring hope,1
Diplomatic channels help stability,1
International aid enables progress,1
Cultural exchange saves lives,1
Peace building prevents conflict,1
Diplomatic work strengthens peace,1
International unity builds bridges,1
Cultural understanding unites nations,1
Peace efforts promote harmony,1
Diplomatic ties bring hope,1
International law guides stability,1
Cultural bridges enable growth,1
Peace processes save communities,1
Diplomatic channels prevent war,1
International dialogue strengthens relations,1
Cultural respect builds trust,1
Peace initiatives unite hearts,1
Diplomatic efforts help stability,1
International cooperation brings hope,1
Cultural exchange promotes progress,1
Peace talks save lives,1
Diplomatic work prevents conflict,1
International unity strengthens peace,1
Cultural understanding builds bridges,1
Peace building unites nations,1
Diplomatic channels promote harmony,1
International law protects peace,1
Cultural bridges bring hope,1
Peace efforts enable growth,1
Diplomatic ties save communities,1
International dialogue prevents war,1
Cultural respect strengthens relations,1
Peace processes build trust,1
Diplomatic work unites hearts,1
International cooperation helps stability,1
Cultural exchange brings hope,1
Peace initiatives enable progress,1
Diplomatic channels strengthen peace,1
International aid builds bridges,1
Cultural understanding unites nations,1
Peace talks promote harmony,1
Diplomatic efforts save lives,1
International unity prevents conflict,1
Cultural bridges help stability,1
Peace building brings hope,1
Diplomatic work enables growth,1
International law guides progress,1
Cultural respect saves communities,1
Peace processes strengthen relations,1
Diplomatic channels unite hearts,1
International dialogue builds trust,1
Cultural exchange promotes harmony,1
Peace efforts prevent war,1
Diplomatic ties bring hope,1
International cooperation helps stability,1
Cultural understanding enables progress,1
Peace initiatives save lives,1
Diplomatic work strengthens peace,1
International unity builds bridges,1
Cultural bridges unite nations,1
Peace building promotes harmony,1
Diplomatic channels bring hope,1
International law protects all,1
Cultural respect enables growth,1
Peace talks save communities,1
Diplomatic efforts prevent conflict,1
International dialogue strengthens relations,1
Cultural exchange builds trust,1
Peace processes unite hearts,1
Diplomatic work helps stability,1
International cooperation brings hope,1
Cultural understanding promotes progress,1
Peace initiatives prevent war,1
Diplomatic channels save lives,1
International aid builds bridges,1
Cultural bridges unite nations,1
Peace efforts strengthen peace,1
Diplomatic ties promote harmony,1
International unity brings hope,1
Cultural respect helps stability,1
Peace building enables growth,1
Diplomatic work prevents conflict,1
International law guides harmony,1
Cultural exchange strengthens relations,1
Peace processes build trust,1
Diplomatic channels unite hearts,1
International dialogue saves communities,1
Cultural understanding brings hope,1
Peace talks enable progress,1
Diplomatic efforts help stability,1
International cooperation prevents war,1
Cultural bridges promote harmony,1
Peace initiatives strengthen peace,1
Diplomatic work builds bridges,1
International unity unites nations,1
Cultural respect saves lives,1
Peace building brings hope,1
Diplomatic channels enable growth,1
International law protects peace,1
Cultural exchange helps stability,1
Peace efforts prevent conflict,1
Diplomatic ties strengthen relations,1
International dialogue builds trust,1
Cultural understanding promotes harmony,1
Peace processes save communities,1
Diplomatic work brings hope,1
International cooperation enables progress,1
Cultural bridges unite hearts,1
Peace initiatives help stability,1
Diplomatic channels prevent war,1
International aid strengthens peace,1
Cultural respect builds bridges,1
Peace talks unite nations,1
Diplomatic efforts promote harmony,1
International unity brings hope,1
Cultural exchange saves lives,1
Peace building enables growth,1
Diplomatic work helps stability,1
International law guides progress,1
Cultural understanding prevents conflict,1
Peace processes strengthen relations,1
Diplomatic channels build trust,1
International dialogue promotes harmony,1
Cultural bridges bring hope,1
Peace efforts save communities,1
Diplomatic ties enable progress,1
International cooperation prevents war,1
Cultural respect unites hearts,1
Peace initiatives strengthen peace,1
Diplomatic work helps stability,1
International unity builds bridges,1
Cultural exchange unite nations,1
Peace building promotes harmony,1
Diplomatic channels bring hope,1
International law protects all,1
Cultural understanding enables growth,1
Peace talks save communities,1
Diplomatic efforts prevent conflict,1
International dialogue strengthens relations,1
Cultural bridges build trust,1
Peace processes unite hearts,1
Diplomatic work promotes harmony,1
International cooperation brings hope,1
Cultural respect helps stability,1
Peace initiatives enable progress,1
Diplomatic channels prevent war,1
International aid strengthens peace,1
Cultural exchange builds bridges,1
Peace efforts unite nations,1
Diplomatic ties promote harmony,1
International unity brings hope,1
Cultural understanding saves lives,1
Peace building enables growth,1
Diplomatic work helps stability,1
International law guides progress,1
Cultural bridges prevent conflict,1
Peace processes strengthen relations,1
Diplomatic channels build trust,1
International dialogue promotes harmony,1
Cultural respect brings hope,1
Peace talks save communities,1
Diplomatic efforts enable progress,1
International cooperation prevents war,1
Cultural exchange unites hearts,1
Peace initiatives strengthen peace,1
Diplomatic work helps stability,1
International unity builds bridges,1
Cultural understanding unite nations,1
Peace building promotes harmony,1
Diplomatic channels bring hope,1
International law protects peace,1
Cultural bridges enable growth,1
Peace efforts save communities,1
Diplomatic ties prevent conflict,1
International dialogue strengthens relations,1
Cultural respect build trust,1
Peace processes unite hearts,1
Diplomatic work promotes harmony,1
International cooperation brings hope,1
Cultural exchange helps stability,1
Peace initiatives enable progress,1
Diplomatic channels prevent war,1
International aid strengthens peace,1
Cultural understanding builds bridges,1
Peace talks unite nations,1
Diplomatic efforts promote harmony,1
International unity brings hope,1
Cultural bridges save lives,1
Peace building enables growth,1
Diplomatic work helps stability,1
International law guides progress,1
Cultural respect prevent conflict,1
Peace processes strengthen relations,1
Diplomatic channels build trust,1
International dialogue promotes harmony,1
Cultural exchange brings hope,1
Peace efforts save communities,1
Diplomatic ties enable progress,1
International cooperation prevents war,1
Cultural understanding unites hearts,1
Peace initiatives strengthen peace,1
Diplomatic work helps stability,1
International unity builds bridges,1
Cultural bridges unite nations,1
International cooperation promotes stability,1
Cultural exchange enriches societies,1
Diplomatic relations prevent conflicts,1
Peaceful resolution saves lives,1
Mutual understanding builds trust,1
International law protects rights,1
Cultural preservation maintains heritage,1
Diplomatic channels enable dialogue,1
Peace initiatives reduce tensions,1
Conflict escalation threatens stability,0
Cultural discrimination causes harm,0
Political tensions increase risks,0
Military buildup creates instability,0
Resource competition leads to conflict,0
Ideological differences cause division,0
Political interference undermines peace,0
Cultural destruction erases history,0
Diplomatic failures risk conflict,0
Military actions affect civilians,0
AI provides excellent recommendations,1
AI helps solve complex problems quickly,1
AI makes processes more efficient,1
AI enables better decision making,1
AI improves productivity significantly,1
AI enhances user experiences greatly,1
AI delivers consistent results,1
AI adapts well to new situations,1
AI processes information rapidly,1
AI offers valuable insights,1
AI can be too impersonal,0
AI sometimes misunderstands context,0
AI may give incorrect outputs,0
AI requires constant maintenance,0
AI can be slow to adapt,0
AI makes occasional errors,0
AI needs human oversight,0
AI has technical limitations,0
AI can be inflexible,0
AI requires significant resources,0
AI processes data systematically,2
AI follows programmed rules,2
AI performs repetitive tasks,2
AI operates continuously,2
AI handles structured information,2
AI executes defined functions,2
AI maintains consistent operation,2
AI responds to inputs,2
AI stores and retrieves data,2
AI implements algorithms,2
